mysql> use united;
Reading table information for completion of table and column names
You can turn off this feature to get a quicker startup with -A

Database changed
mysql> use uSquare;
ERROR 1049 (42000): Unknown database 'uSquare'
mysql> create table uSquare(id tinyint primary key , fName varchar(20) not null , lName varchar(20) , age check(age>=1));
ERROR 1064 (42000): You have an error in your SQL syntax; check the manual that corresponds to your MySQL server version for the right syntax to use near 'check(age>=1))' at line 1
mysql> create table uSquare(id tinyint primary key , fName varchar(20) not null , lName varchar(20) , age tinyint check(age>=1));
ERROR 1050 (42S01): Table 'uSquare' already exists
mysql> create table aspirants(id tinyint primary key , fName varchar(20) not null , lName varchar(20) , age tinyint check(age>=1));
Query OK, 0 rows affected (0.04 sec)

mysql> create table tendots(id tinyint primary key , fName varchar(20) not null , lName varchar(20) , age check(age>=1));
ERROR 1064 (42000): You have an error in your SQL syntax; check the manual that corresponds to your MySQL server version for the right syntax to use near 'check(age>=1))' at line 1
mysql> create table tendots(id tinyint primary key , fName varchar(20) not null , lName varchar(20) , age tinyint check(age>=1));
Query OK, 0 rows affected (0.05 sec)

mysql> desc aspirants;
+-------+-------------+------+-----+---------+-------+
| Field | Type        | Null | Key | Default | Extra |
+-------+-------------+------+-----+---------+-------+
| id    | tinyint     | NO   | PRI | NULL    |       |
| fName | varchar(20) | NO   |     | NULL    |       |
| lName | varchar(20) | YES  |     | NULL    |       |
| age   | tinyint     | YES  |     | NULL    |       |
+-------+-------------+------+-----+---------+-------+
4 rows in set (0.01 sec)

mysql> desc tendots;
+-------+-------------+------+-----+---------+-------+
| Field | Type        | Null | Key | Default | Extra |
+-------+-------------+------+-----+---------+-------+
| id    | tinyint     | NO   | PRI | NULL    |       |
| fName | varchar(20) | NO   |     | NULL    |       |
| lName | varchar(20) | YES  |     | NULL    |       |
| age   | tinyint     | YES  |     | NULL    |       |
+-------+-------------+------+-----+---------+-------+
4 rows in set (0.00 sec)

mysql> show tables;
+------------------+
| Tables_in_united |
+------------------+
| aspirants        |
| blazers          |
| tendots          |
| uSquare          |
+------------------+
4 rows in set (0.01 sec)

mysql> insert into aspirants value(1,"vaishnavi","paramathma",18);
Query OK, 1 row affected (0.01 sec)

mysql> insert into aspirants value(2,"                    

^C
mysql> insert into aspirants value(2,"keerthana","shanmugam",18),(3,"meenu","sowjanya",18),(4,"kasi","antony",18),(5,"suguram","krishna",19);
Query OK, 4 rows affected (0.01 sec)
Records: 4  Duplicates: 0  Warnings: 0

mysql> insert into tendots value(1,"poorani","shanmugam",18),(3,"sangeetha","sowjanya",18),(4,"maha","antony",18),(5,"vaishu","krishna",19);
Query OK, 4 rows affected (0.01 sec)
Records: 4  Duplicates: 0  Warnings: 0

mysql> select * from aspirants;
+----+-----------+------------+------+
| id | fName     | lName      | age  |
+----+-----------+------------+------+
|  1 | vaishnavi | paramathma |   18 |
|  2 | keerthana | shanmugam  |   18 |
|  3 | meenu     | sowjanya   |   18 |
|  4 | kasi      | antony     |   18 |
|  5 | suguram   | krishna    |   19 |
+----+-----------+------------+------+
5 rows in set (0.01 sec)

mysql> select * from tendots;
+----+-----------+-----------+------+
| id | fName     | lName     | age  |
+----+-----------+-----------+------+
|  1 | poorani   | shanmugam |   18 |
|  3 | sangeetha | sowjanya  |   18 |
|  4 | maha      | antony    |   18 |
|  5 | vaishu    | krishna   |   19 |
+----+-----------+-----------+------+
4 rows in set (0.00 sec)

mysql> delete from aspirants where id=3;
Query OK, 1 row affected (0.01 sec)

mysql> insert into tendots(id ,lName, age) values(6,"ismail",18);
ERROR 1364 (HY000): Field 'fName' doesn't have a default value
mysql> insert into tendots(id ,fName, lName) values(6,"ismail","smile");
Query OK, 1 row affected (0.00 sec)

mysql> select * from tendots;
+----+-----------+-----------+------+
| id | fName     | lName     | age  |
+----+-----------+-----------+------+
|  1 | poorani   | shanmugam |   18 |
|  3 | sangeetha | sowjanya  |   18 |
|  4 | maha      | antony    |   18 |
|  5 | vaishu    | krishna   |   19 |
|  6 | ismail    | smile     | NULL |
+----+-----------+-----------+------+
5 rows in set (0.00 sec)

mysql> select * from aspirants;
+----+-----------+------------+------+
| id | fName     | lName      | age  |
+----+-----------+------------+------+
|  1 | vaishnavi | paramathma |   18 |
|  2 | keerthana | shanmugam  |   18 |
|  4 | kasi      | antony     |   18 |
|  5 | suguram   | krishna    |   19 |
+----+-----------+------------+------+
4 rows in set (0.00 sec)


